{
  "schema_version": "1.0",
  "organization_id": "org_1",
  "user_id": "system_user",
  "agent_id": "agent_1",
  "server_id": "server_1",
  "request_id": "req_lease_1",
  "correlation_id": "corr_control_1",
  "idempotency_key": "idem_lease_1",
  "created_at": "2026-07-18T00:05:00Z",
  "revision": 1,
  "sequence": 6,
  "signature": {
    "algorithm": "hmac-sha256",
    "key_id": "key_server_1",
    "value": "FFFFFFFFFFFFFFFFFFFFFFFFFFFFFFFFFFFFFFFFFFFFFFFFFFFFFFFFFFFFFFFF",
    "signed_at": "2026-07-18T00:05:01Z"
  },
  "limit": 5,
  "lease_seconds": 120,
  "requested_at": "2026-07-18T00:05:02Z",
  "capability_refs": ["ref:control-lease-v1"]
}
